Journal Entry,Mood
"A candle flickered on the desk, its glow filling the room with warmth. The gentle light felt grounding, as though it made the space safer.",Calm
The sound of leaves brushing against each other created a soft background as I sat outside. It felt like nature itself was breathing with me.,Calm
"The pages of the book turned slowly, each one drawing me deeper into the story. My breathing matched the steady rhythm, and everything felt unhurried.",Calm
"With a warm cup of tea in hand, I curled into the blanket and let the silence settle around me. The calm felt steady, like a weight lifting.",Calm
"The light from the setting sun filled the room with soft colors. Each shade seemed to melt into the next, wrapping the evening in peace.",Calm
"A gentle breeze drifted through the open window, carrying the scent of fresh grass. Sitting there in the stillness, it felt like time itself had paused.",Calm
"Soft rain tapped against the window this morning, and I let the sound guide me into a slower rhythm. The world outside felt hushed, and I carried that quiet with me through the day.",Calm
"The night air was cool and crisp, and I took a slow walk outside before bed. Each step felt unhurried, and the quietness wrapped around me like a blanket.",Calm
"I listened to an audiobook while lying on the couch, and my mind felt so light. It was the perfect way to unwind.",Calm
"Work didn’t overwhelm me today, and I moved through tasks at a steady pace. When I closed my laptop, I didn’t feel drained.",Calm
I brewed some herbal tea and wrapped myself in a blanket. The warmth made me feel safe and cozy.,Calm
"I stayed off my phone for most of the day, and it made such a difference. Instead, I cooked, read, and just let myself be present.",Calm
"The sunset tonight was stunning, with soft pinks and oranges stretching across the sky. It filled me with a quiet sense of peace.",Calm
"I spent the afternoon sketching, not worrying about whether it looked good or not. By the end, I felt more centered than I have in days.",Calm
"I took a long bath tonight and let the warm water wash away my stress. For once, I didn’t think about anything but the sound of the water.",Calm
The evening was so still that even the smallest sounds felt comforting. I let myself stretch out and rest without worrying about tomorrow.,Calm
I lit a candle in my room and let the scent fill the air while I journaled. The soft light made everything feel calm and safe.,Calm
This morning I just sat on the porch with my coffee and watched the world wake up. It was such a gentle start to the day.,Calm
"I played some soft music while cleaning, and it actually felt relaxing instead of like a chore. I ended the night feeling refreshed.",Calm
"The day was steady and smooth, with no interruptions or stress. I kept my phone aside and enjoyed some time to myself.",Calm
"I sat by the lake today and watched the water ripple. The sound was gentle, almost hypnotic.",Calm
"I meditated before bed tonight, and it helped me release the tension I hadn’t realized I was carrying. By the end, I felt light and still.",Calm
"Dinner was simple but enjoyable, and I ate slowly without distraction. I felt grateful for the quiet evening.",Calm
"After finishing my work, I curled up with a book and lost myself in the story. It was comforting in the best way.",Calm
"I went for a slow walk through the park, and the cool breeze was soothing on my skin. I felt completely present.",Calm
"Today was quiet and uneventful, which felt refreshing after such a busy week. I brewed a cup of tea and listened to the soft rain outside.",Calm
"I spent the afternoon sitting by the window, just watching the sunlight move across the floor. The stillness was exactly what I needed.",Calm
"Thoughts of past missteps mingled with fears of future problems, keeping my mind on high alert.",Anxious
The pressure to handle daily tasks perfectly made it hard to begin anything.,Anxious
Conversations with coworkers or classmates left me second-guessing every word I said.,Anxious
"A tight feeling in my chest never fully went away, reminding me of potential mistakes I hadn’t yet made.",Anxious
"Time spent on work was overshadowed by imagined failures, making progress feel impossible.",Anxious
"Even casual interactions triggered worry, making me replay every word afterward.",Anxious
"Small mistakes felt like failures, magnified by the anxious lens through which I viewed them.",Anxious
Thoughts of what could go wrong in the coming days left me pacing and tense.,Anxious
"A persistent knot of anxiety lingered, refusing to loosen even during moments of quiet.",Anxious
"Tasks that usually feel routine triggered spirals of doubt, leaving me exhausted.",Anxious
"Imagined judgments from others kept replaying in my head, making social situations stressful.",Anxious
"Even after completing responsibilities, a sense of unease lingered, convinced I hadn’t done enough.",Anxious
"The looming deadlines made each minor task feel catastrophic, as worry overwhelmed my focus.",Anxious
"Every sound in my environment felt like a warning, keeping my nerves on high alert.",Anxious
"A restless mind refused to settle, bouncing from past mistakes to imagined failures in the future.",Anxious
Pressure to perform in small tasks made my hands fidget and my chest tighten.,Anxious
"Conversations with friends left me uneasy, as imagined criticisms took over my thoughts.",Anxious
Tasks that normally bring satisfaction instead triggered worry and doubt about my performance.,Anxious
"Recurring thoughts about past mistakes refused to leave, looping endlessly in my mind.",Anxious
"My body felt tense from constant mental tension, as if bracing for disasters that weren’t real.",Anxious
"Simple choices felt impossible, each decision weighed down by imagined consequences.",Anxious
"Anticipation for upcoming events left me restless, as imagined outcomes grew worse in my mind.",Anxious
"Minor responsibilities felt enormous, as anxiety magnified every possible misstep.",Anxious
"A sense of impending failure clung to me, even when things were going smoothly.",Anxious
"Every corner of my day seemed filled with unseen pressures, keeping me on edge.",Anxious
"Tasks that should have felt manageable instead triggered stress, with worry lingering long afterward.",Anxious
"Even enjoyable moments were shadowed by tension, as my mind raced through imagined problems.",Anxious
"The sound of a notification made my stomach tighten, anticipating bad news that might never come.",Anxious
"Rehearsing potential conversations only heightened my unease, making interactions feel like tests I couldn’t pass.",Anxious
"Focusing on one task at a time was impossible, as anxiety pulled my thoughts in multiple directions.",Anxious
"Every small mistake seemed magnified, making me doubt my ability to handle even minor responsibilities.",Anxious
"Restless energy left me unable to sit still, my mind racing through what-ifs and imagined failures.",Anxious
The thought of tomorrow’s obligations made it difficult to focus on anything enjoyable today.,Anxious
"Conversations replayed in my head, twisting into imagined critiques that kept me tense.",Anxious
Preparing for upcoming deadlines made each small task feel urgent and overwhelming.,Anxious
"A constant hum of worry kept my mind alert and restless, preventing any true sense of calm.",Anxious
"Every glance from others felt critical, making it impossible to relax during routine interactions.",Anxious
"Waiting for a response left me pacing the room, thinking of all the ways things could go wrong.",Anxious
Tension spread through my shoulders and jaw as imagined problems kept my body on edge.,Anxious
"Time spent trying to focus on work felt wasted, as my mind kept wandering to worst-case scenarios.",Anxious
"The quiet of the evening only made my anxious thoughts louder, looping over mistakes that hadn’t even happened.",Anxious
"Tasks that normally feel simple seemed insurmountable, and my thoughts raced ahead to all the ways I could fail.",Anxious
"A sense of dread lingered as I walked through familiar spaces, imagining people noticing every small mistake.",Anxious
"Replaying conversations in my head left me restless, convinced I had said something wrong.",Anxious
"Notifications on my phone sparked a wave of panic, each one making the pressure feel unbearable.",Anxious
"Moments of silence felt heavy, as if every imagined problem was amplified in my mind.",Anxious
"The thought of unfinished tasks made my stomach churn repeatedly, and it was impossible to settle down.",Anxious
"A tightness in my chest followed me through the afternoon, making it hard to focus on anything else.",Anxious
"Even as I tried to relax, my thoughts refused to stop racing. Each imagined failure pulled me further into tension.",Anxious
I spent too much time anticipating mistakes for tomorrow. The pressure left me restless and drained throughout the evening.,Anxious
"Even after finishing tasks, I felt like I hadn’t done enough. My mind fixated on imagined shortcomings, keeping the anxiety alive.",Anxious
"I noticed my hands fidgeting constantly as I tried to focus. Each movement reminded me of my inner tension, making it worse.",Anxious
"Even when nothing urgent was happening, I felt anxious. My mind jumped from one potential problem to another without pause.",Anxious
I spent the evening worrying about what I hadn’t accomplished. Each imagined failure magnified the tightness in my chest.,Anxious
Even short interactions with others left me feeling self-conscious. I replayed my words and imagined judgment long afterward.,Anxious
I found it hard to sit still without my mind racing. The tension in my body matched the anxious thoughts that refused to stop.,Anxious
"Even after making progress on work, I felt uneasy. My mind immediately shifted to future concerns and imagined failures.",Anxious
I felt jumpy and restless all day. Every minor task or responsibility seemed fraught with potential mistakes and failure.,Anxious
"Even when I tried to focus on enjoyable activities, my thoughts refused to cooperate. Anxiety kept pulling me back into tension.",Anxious
"The quiet of the evening didn’t feel calming. My mind kept spinning through past and future problems, leaving me exhausted.",Anxious
Even familiar environments felt stressful. I imagined people judging my every action and couldn’t shake the tightness in my chest.,Anxious
"I kept checking my phone repeatedly, expecting something to be wrong. Each notification amplified the anxiety that wouldn’t subside.",Anxious
Even small responsibilities felt overwhelming. Each imagined mistake or misstep made it impossible to relax.,Anxious
I noticed tension in my shoulders and jaw all day. It felt like my body was bracing for something that hadn’t even happened yet.,Anxious
"Even completing tasks didn’t bring relief. I immediately focused on what could go wrong next, leaving me tense and restless.",Anxious
Trying to concentrate on reading was impossible. My mind kept racing through imagined problems and past mistakes.,Anxious
"Even when friends tried to distract me, anxious thoughts intruded. I couldn’t stop imagining worst-case scenarios for everything.",Anxious
"I felt on edge throughout the day. Every sound or movement seemed magnified, keeping my nerves constantly alert.",Anxious
"Even when I tried to enjoy a quiet activity, my mind refused to settle. Each imagined failure pulled me back into tension.",Anxious
The thought of tomorrow’s deadlines pressed heavily on me. I couldn’t plan effectively because the anxiety kept building.,Anxious
"Even short walks outside didn’t calm me. I felt tense and alert, anticipating problems that weren’t real.",Anxious
I kept replaying past conversations and imagining criticism. The imagined judgments kept looping in my mind relentlessly.,Anxious
Even moments of rest felt uneasy. My mind wandered to every potential mistake or failure I could foresee.,Anxious
"Every time I opened my laptop, anxiety surged. The tasks waiting for me felt insurmountable, and I froze instead of acting.",Anxious
"I spent too much time imagining worst-case outcomes for small events. Even when nothing bad happened, the tension didn’t lift.",Anxious
Even simple phone calls felt stressful. I worried constantly about how I might stumble over words or appear unprepared.,Anxious
"I kept pacing the room, trying to shake off nervous energy. Each imagined problem seemed to grow bigger the more I thought about it.",Anxious
"Even mundane tasks felt daunting. My mind focused on all the ways I could fail, making it impossible to start anything.",Anxious
"I noticed my hands trembling slightly as I tried to focus. Each time it happened, the anxiety worsened.",Anxious
"During the day, every little mistake seemed amplified. I felt like I couldn’t recover from even minor errors.",Anxious
"Even after finishing a project, I couldn’t relax. My thoughts immediately jumped to what could go wrong next, keeping me restless.",Anxious
The thought of tomorrow’s responsibilities kept me awake. My mind wouldn’t stop racing through everything I might forget or mishandle.,Anxious
"Even casual conversations left me tense. I replayed every word in my mind, imagining how it could have sounded wrong or awkward.",Anxious
"I kept thinking about deadlines I hadn’t finished. The pressure made it impossible to focus, and every task felt overwhelming.",Anxious
"Even walking outside made me uneasy. I imagined everyone noticing my nervousness, and it kept me on edge the whole time.",Anxious
I found myself double-checking everything I did today. Each imagined slip-up magnified the tension in my chest.,Anxious
"Even when friends reassured me, the anxiety persisted. My mind kept looping over past mistakes and imagined criticisms.",Anxious
Trying to study felt impossible. Every minor distraction sent my thoughts spiraling into worst-case scenarios.,Anxious
"The silence in my room didn’t feel peaceful. My mind raced through every potential failure I could imagine, and I felt trapped in tension.",Anxious
Even short interactions with strangers made me self-conscious. I couldn’t stop imagining they were judging me harshly.,Anxious
"Preparing for tomorrow’s presentation left me pacing the apartment. I imagined every possible mistake, and the tension grew heavier with each rehearsal.",Anxious
"Even after completing tasks, I felt uneasy. My mind immediately jumped to what could go wrong next, leaving me drained.",Anxious
"I kept replaying casual conversations with friends, imagining awkward moments I probably didn’t even have. The anxiety made it hard to enjoy the present.",Anxious
Checking emails made my stomach knot with worry. Each unread message felt like a looming problem I wasn’t ready to face.,Anxious
"I felt restless throughout the evening. Every sound seemed amplified, making my chest tighten with unease.",Anxious
Even a quiet moment alone didn’t calm me. My thoughts kept looping over past mistakes and imagined problems in the future.,Anxious
"I tried to focus on my homework, but my mind kept jumping to worst-case scenarios. The pressure made it impossible to concentrate.",Anxious
"Walking into class made my heart race. Every glance felt like judgment, and I couldn’t stop fidgeting with my hands.",Anxious
"Even small chores felt overwhelming today. I kept imagining all the ways I could mess up, and the tension in my body never eased.",Anxious
"I spent the morning feeling tense, replaying everything I said yesterday in my head. Every interaction felt critical, and I couldn’t convince myself that it was all fine.",Anxious
"Even when I tried to focus on something enjoyable, anxious thoughts kept intruding. Each imagined problem or mistake pulled me back into tension, making it impossible to feel at ease.",Anxious
"The silence of the night didn’t bring any relief. My mind kept racing through imagined failures and upcoming challenges, and I couldn’t calm the tightness in my chest.",Anxious
"I felt on edge throughout the day, like something bad was waiting to happen. Every sound or movement around me seemed amplified, keeping my nerves constantly alert.",Anxious
"Even after completing tasks, I couldn’t stop thinking about what I might have done wrong. Each imagined mistake felt as real as the work I had actually finished.",Anxious
"The thought of tomorrow’s responsibilities pressed heavily on me all evening. I tried to prepare, but the more I thought about it, the more my anxiety built.",Anxious
"Even casual interactions made me nervous. I replayed each word and gesture in my mind, imagining how I might have appeared awkward or unprepared.",Anxious
"Trying to focus on reading, my attention kept drifting to everything that could go wrong tomorrow. The tension in my shoulders made it hard to sit still, and I couldn’t stop fidgeting.",Anxious
"I felt a constant knot of worry in my stomach, even when nothing urgent was happening. My mind jumped from one potential problem to the next, and it was impossible to relax.",Anxious
Even short tasks left me tense and restless today. My thoughts darted between what I had to do and all the ways I might fail at it.,Anxious
"Opening my email felt like a test I wasn’t ready for. Every unread message sparked worry, and I spent far too long imagining worst-case scenarios.",Anxious
"I found myself pacing around the apartment, trying to shake off the anxious energy. Every imagined problem seemed to grow bigger the more I thought about it, leaving me exhausted.",Anxious
"Even as I tried to rest, my mind refused to slow down. Every imagined failure or mistake kept me on edge, and my body felt like it was bracing for something bad.",Anxious
"During a casual conversation with friends, I felt jittery and self-conscious. My mind focused on every small slip of the tongue, imagining judgment that probably wasn’t there.",Anxious
"I kept checking my phone over and over, waiting for a response that might never come. Each notification brought a mix of hope and dread, and my thoughts refused to settle.",Anxious
"The pressure of deadlines kept weighing on me throughout the day. Even tasks I normally enjoy felt overwhelming, and I couldn’t convince myself to start anything.",Anxious
"Even a quiet moment alone didn’t feel peaceful. My mind kept bouncing between past mistakes and imagined future problems, and I couldn’t stop the tightness in my chest.",Anxious
"Walking into a familiar room felt unexpectedly stressful today. I imagined everyone noticing my nervousness, even though I knew logically that no one was paying that much attention.",Anxious
"I noticed my hands trembling slightly as I tried to concentrate on homework. Each time I felt the tension, my thoughts spiraled further into worry about falling behind.",Anxious
"Even the thought of tomorrow’s tasks made my stomach churn. I tried to focus on one thing at a time, but my mind kept racing ahead to all the ways things could go wrong.",Anxious
"I spent hours replaying conversations from earlier in the week, convinced I had said something wrong. Every detail felt magnified in my mind, and I couldn’t let go of the tension that had built up.",Anxious
"Even as I tried to enjoy a quiet moment, my thoughts refused to cooperate. Each imagined mistake or future problem kept pulling me back into tension.",Anxious
"I found myself pacing around the room, trying to shake off the anxious energy. Every small worry seemed to grow bigger the more I focused on it.",Anxious
"The thought of upcoming presentations made my heart race. I rehearsed every scenario in my head, but nothing seemed enough to calm me.",Anxious
"Even after finishing a task, I felt restless. My mind immediately jumped to what could go wrong next.",Anxious
"I kept reviewing conversations from earlier in the day, convinced I had said something wrong. The imagined critiques kept looping in my mind.",Anxious
Even walking outside didn’t calm me. Every sound or glance felt like a signal that something could go wrong.,Anxious
"Every time I opened my laptop, I felt a wave of panic. The tasks waiting for me seemed insurmountable, and I froze in indecision.",Anxious
"I spent too much time imagining worst-case outcomes for minor events. Even when nothing happened, the tension didn’t let up.",Anxious
"Even when friends tried to comfort me, my mind refused to quiet down. I kept replaying past mistakes and worrying about future ones.",Anxious
The thought of tomorrow’s deadlines made my stomach knot repeatedly. I couldn’t stop imagining how unprepared I might be.,Anxious
I felt a constant tightness in my shoulders and jaw all day. It was like my body was bracing for something that hadn’t even happened yet.,Anxious
"During class, I felt restless and distracted. Every comment I heard was twisted in my mind into potential criticism.",Anxious
Even simple chores felt impossible. My mind kept racing through everything I could be doing wrong or forgetting.,Anxious
"I couldn’t stop checking messages, fearing I’d missed something important. Each notification sparked a new wave of tension through me.",Anxious
"The silence of the evening felt heavy, not calming. My thoughts jumped from one imagined disaster to another, and my body stayed tense.",Anxious
"Even small social interactions made my stomach churn. I imagined being judged for every word I said, and the anxiety lingered long after the conversation ended.",Anxious
Trying to concentrate on my homework was impossible today. Every little distraction pulled me into spirals of worry and self-doubt.,Anxious
I felt my chest tighten each time I thought about the upcoming meeting. My mind raced with every potential problem I might encounter.,Anxious
Even mundane tasks like sending an email left me tense and unsettled. I kept replaying imagined scenarios in my head and couldn’t focus on anything else.,Anxious
"My thoughts refused to settle even in the quiet of my room. I kept imagining every possible mistake I could make tomorrow, and it felt impossible to relax.",Anxious
"Even after completing a task, I couldn’t stop worrying about whether it was good enough. My mind kept replaying imagined criticisms, and the tension stayed with me. Relaxation felt impossible, even for a moment.",Anxious
"I noticed my hands shaking slightly while working on a project. Each time I saw the trembling, the anxiety worsened. It was hard to convince myself that everything was under control.",Anxious
"Trying to study, my thoughts kept spinning out of control. Every small distraction pulled me into imagining negative outcomes, and I felt trapped in a cycle I couldn’t escape. My body was tense, and my energy felt drained.",Anxious
"Even casual social interactions left me unsettled. I replayed conversations over and over, imagining how I could have said things differently. My stomach twisted with each imagined misstep.",Anxious
"I found myself double-checking everything I had done today. Each mistake I imagined made me question my abilities, and my mind refused to quiet down. The worry lingered long into the evening.",Anxious
"The deadlines looming over me made my chest tighten continuously. I tried to plan my day, but every small setback felt catastrophic. Even tasks I normally enjoy felt stressful and impossible to start.",Anxious
"Even as I walked through familiar places, I felt tense and alert. My mind kept running through possible mistakes or awkward encounters. The tension made my steps feel heavy, even though nothing was wrong.",Anxious
"I kept thinking about what might go wrong tomorrow. Every small detail seemed significant, and I couldn’t stop imagining negative outcomes. The anxiety felt like a constant hum under my skin.",Anxious
"Every time I tried to focus on a single task, my mind darted to everything else I hadn’t done. The mental pressure built like a wave, and I felt incapable of keeping up. Even short breaks didn’t help, because the worry followed me everywhere.",Anxious
"The quiet in my apartment didn’t feel comforting; it made my thoughts louder instead. I kept imagining worst-case scenarios for tasks I hadn’t even started yet. My body stayed tense, and it was hard to breathe freely.",Anxious
Even a simple phone call felt overwhelming today. My heart raced as I imagined how I might stumble over words or make a bad impression. I kept rehearsing everything in my head and still felt unprepared.,Anxious
"Opening my email was like opening a Pandora’s box. Every message sparked worry, and I imagined all the ways I could have missed something important. The anxiety lingered long after I closed my inbox.",Anxious
"Even when surrounded by friends, I felt disconnected and tense. I laughed and smiled, but my mind was racing with doubts about everything I said or did. It felt impossible to truly relax.",Anxious
"The thought of tomorrow’s meeting left a knot in my stomach all day. I tried to prepare, but each time I rehearsed, the anxiety only grew. My thoughts kept jumping ahead to all the ways it could go wrong.",Anxious
"Even lying down in my room didn’t bring any relief. My mind replayed small mistakes from earlier and imagined scenarios that hadn’t even happened yet. My body felt tense, like I was bracing for something unknown.",Anxious
"Talking to a coworker or classmate felt like walking on a tightrope. I worried constantly about saying the wrong thing or being misunderstood, and my hands wouldn’t stop fidgeting. By the end of the conversation, I felt completely drained.",Anxious
